KEGG_APOPTOSIS,43,16,0.899,0.644,0.86,0.84,0.84,0.81,0.8,0.76,0.73,0.75,0.76,1.5,"Aifm1, Akt1, Akt2;AK206940, Bad, Bax, Bcl2l1, Bid, Casp6, Casp7, Casp8, Cflar, Chuk, Cycs, Dffa, Endog, Fadd, Fas, IKKbeta;Ikbkb;Ikkb, IRAK1-S;Irak1;Mir718, Ikbkg, Il1r1, Il1rap, Irak-2;Irak2, Irak4, Myd88, Nfkb1, Nfkbia, Pik3ca, Pik3r1, Pik3r2, Ppp3ca, Ppp3cb, Prkaca, Prkacb, Prkar1a, Prkar2a, Rela, Ripk1, Tnfrsf1a, Tradd, Traf2, Xiap, calp80;Capn2","Aifm1, Akt2;AK206940, Bcl2l1, Casp6, Cflar, Cycs, Endog, IRAK1-S;Irak1;Mir718, Il1r1, Myd88, Pik3r1, Pik3r2, Prkaca, Rela, Tnfrsf1a, Xiap"
KEGG_ADHERENS_JUNCTION,46,17,0.914,0.644,0.79,0.75,0.74,0.74,0.72,0.69,0.69,0.7,0.72,1,"Actb, Actn1, Actn4, Baiap2, Cdc42, Cdh1;AK041755, Crebbp, Csnk2a1, Csnk2a2, Csnk2b, Ctnna1;AK008288, Ctnnb1, Ctnnd1, Egfr, Ep300, Insr, Iqgap1, Lmo7, Map3k7, Mapk1, Mapk3, Met;Sltm, Mllt4, Nlk, Pard3, Ptpn1, Ptpn6, Ptprf, Ptprj, Pvrl1, Pvrl2, Pvrl3, Rac1, Rac2, Rhoa, Smad3;AK214683, Smad4, Sorbs1;mKIAA1296, Ssx2ip;mKIAA0923, Tcf7l1, Tcf7l2, Tgfbr1, Tjp1, Vcl, Wasf2;AK199358, Wasl","Actb, Actn4, Baiap2, Cdh1;AK041755, Csnk2a2, Ctnnb1, Ep300, Met;Sltm, Pard3, Ptprj, Pvrl1, Pvrl2, Rac1, Smad3;AK214683, Sorbs1;mKIAA1296, Tcf7l1, Wasf2;AK199358"
KEGG_NOD_LIKE_RECEPTOR_SIGNALING_PATHWAY,25,8,0.921,0.644,0.88,0.84,0.85,0.82,0.8,0.77,0.74,0.75,0.78,1,"Card6, Casp8, Ccl5, Chuk, Erbb2ip;mKIAA1225, Hsp90aa1, Hsp90ab1, Hsp90b1, IKKbeta;Ikbkb;Ikkb, Ikbkg, Il18, Jnk2;Mapk9, Map3k7, Mapk1, Mapk14, Mapk3, Nfkb1, Nfkbia, Nfkbib, Nod1, Rela, Sugt1, Tab2, Trip6, Xiap","Erbb2ip;mKIAA1225, Hsp90aa1, Hsp90ab1, Hsp90b1, Nfkbib, Rela, Tab2, Xiap"
KEGG_PROGESTERONE_MEDIATED_OOCYTE_MATURATION,37,13,0.922,0.644,0.79,0.83,0.77,0.78,0.72,0.72,0.66,0.67,0.7,2,"Adcy6, Adcy9, Akt1, Akt2;AK206940, Anapc1, Anapc11, Anapc13, Anapc2, Anapc4, Anapc5, Anapc7, Araf, Braf, Cdc16, Cdc26, Dctn5;Plk1, Fyr;Fzr1, Gnai2, Gnai3, Hsp90aa1, Hsp90ab1, Igf1, Jnk2;Mapk9, Mad2l2, Map2k1, Mapk1, Mapk14, Mapk3, Nras;Kras, Pde3b, Pik3ca, Pik3r1, Pik3r2, Prkaca, Prkacb, Raf1, Rps6ka1","Adcy6, Akt2;AK206940, Araf, Gnai2, Hsp90aa1, Hsp90ab1, Igf1, Map2k1, Pik3r1, Pik3r2, Prkaca, Raf1, Rps6ka1"
KEGG_PANCREATIC_CANCER,37,13,0.922,0.644,0.8,0.81,0.77,0.77,0.72,0.71,0.67,0.68,0.71,2,"Akt1, Akt2;AK206940, Araf, Bad, Bcl2l1, Braf, Cdc42, Cdk4, Chuk, E2f3;E2F3, Egfr, IKKbeta;Ikbkb;Ikkb, Ikbkg, Jak1, Jnk2;Mapk9, Map2k1, Mapk1, Mapk3, Nfkb1, Nras;Kras, Pik3ca, Pik3r1, Pik3r2, Rac1, Rac2, Raf1, Rala, Ralb, Ralbp1, Rela, Smad3;AK214683, Smad4, Stat1, Stat3, Tgfbr1, Vegfa, Vegfb","Akt2;AK206940, Araf, Bcl2l1, Map2k1, Pik3r1, Pik3r2, Rac1, Raf1, Rala, Ralbp1, Rela, Smad3;AK214683, Vegfb"
KEGG_RNA_DEGRADATION,43,14,0.971,0.658,0.85,0.81,0.79,0.78,0.76,0.74,0.7,0.66,0.68,1.5,"AK031165;Cnot3, Aars;Exosc6, BC079836;Cnot6, C1d, Cnot1, Cnot10, Cnot2, Cnot4, Cnot6l, Cnot7, Cnot8, Dcp2, Dcps, Ddx6, Edc3, Edc4, Exosc1, Exosc10, Exosc2, Exosc3, Exosc4, Exosc5, Exosc7, Exosc8, Gm5506;AK180697;Eno1, Hspa9, Hspd1, Lsm1, Lsm2;SmX5, Lsm4, Lsm6, Naa38, Papd7, Papola, Parn, Patl1, Skiv2l, Skiv2l2, Ttc37, Wdr61, Xrn1, Xrn2, Zcchc7","AK031165;Cnot3, Aars;Exosc6, Cnot2, Cnot4, Ddx6, Edc4, Exosc3, Exosc4, Exosc5, Exosc8, Gm5506;AK180697;Eno1, Papola, Skiv2l, Wdr61"
KEGG_RNA_POLYMERASE,19,4,0.985,0.658,0.68,0.8,0.87,0.9,0.94,0.77,0.79,0.86,0.85,5,"Polr1a, Polr1b, Polr1c, Polr1d, Polr2b, Polr2d, Polr2e, Polr2f, Polr2g, Polr2h, Polr2i, Polr2j, Polr2l, Polr3a, Polr3b, Polr3d, Polr3gl, Polr3k, Znrd1","Polr1b, Polr1c, Polr2i, Polr2j"
KEGG_BASE_EXCISION_REPAIR,14,3,0.96,0.658,0.95,0.6,0.64,0.74,0.69,0.61,0.58,0.57,0.56,1,"Apex2, Hmgb1, Nthl1, Parp1, Parp3;Adprt3, Pcna, Polb, Pold3, Pold4, Pole3, Pole4, Smug1, Ung, Xrcc1","Apex2, Parp1, Pold4"
KEGG_NUCLEOTIDE_EXCISION_REPAIR,29,9,0.952,0.658,0.94,0.79,0.76,0.76,0.73,0.71,0.66,0.69,0.74,1,"AK163166;Ercc5, Ccnh, Cdk7, Cul4a, Ddb1, Ercc3, Ercc4, Ercc6, Gtf2h1;p62, Gtf2h3, Gtf2h4, Gtf2h5, Mnat1, Pcna, Pold3, Pold4, Pole3, Pole4, Rad23a, Rad23b, Rbx1, Rfc1, Rfc2, Rfc3, Rfc5, Rpa2, Rpa3, Xpa, Xpc","Ccnh, Cdk7, Gtf2h1;p62, Gtf2h4, Gtf2h5, Pold4, Rad23a, Rfc1, Xpa"
KEGG_MISMATCH_REPAIR,12,2,0.974,0.658,1,0.73,0.69,0.69,0.67,0.61,0.58,0.59,0.63,1,"Mlh3, Msh2, Pcna, Pold3, Pold4, Rfc1, Rfc2, Rfc3, Rfc5, Rpa2, Rpa3, Ssbp1","Pold4, Rfc1"
KEGG_CELL_CYCLE,53,15,0.997,0.658,0.89,0.81,0.79,0.75,0.71,0.69,0.69,0.72,0.7,1,"14-3-3 gamma;Ywhag, Abl1, Anapc1, Anapc11, Anapc13, Anapc2, Anapc4, Anapc5, Anapc7, Bub3, Ccnh, Cdc14b, Cdc16, Cdc26, Cdk4, Cdk7, Cdkn1a, Cdkn1b, Cdkn2c, Crebbp, Cul1, Dctn5;Plk1, E2f3;E2F3, E2f4, Ep300, Fyr;Fzr1, Gadd45a, Gadd45b, Gadd45g, Gsk3b, Hdac1, Hdac2, Mad1;Mad1l1, Mad2l2, Mcm7, Mdm2, Pcna, Pttg1, Rad21, Rbl2, Rbx1, SAP2;Stag2, Smad3;AK214683, Smad4, Smc1a, Smc3, Stag1, Tfdp2, Ywhab, Ywhae, Ywhah, Ywhaq, Ywhaz","14-3-3 gamma;Ywhag, Abl1, Ccnh, Cdk7, Ep300, Gadd45b, Gsk3b, Hdac2, Mdm2, Pttg1, Smad3;AK214683, Smc1a, Smc3, Ywhab, Ywhae"
KEGG_OOCYTE_MEIOSIS,49,15,0.99,0.658,0.85,0.89,0.83,0.81,0.76,0.77,0.76,0.77,0.76,2,"14-3-3 gamma;Ywhag, Adcy6, Adcy9, Anapc1, Anapc11, Anapc13, Anapc2, Anapc4, Anapc5, Anapc7, Calm1, Calm2, Calm3, Camk2b, Camk2d;Camk2g;mKIAA4163, Cdc16, Cdc26, Cul1, Dctn5;Plk1, Fbxw11;mKIAA0696;Btrc;mKIAA4123, Igf1, Itpr1, Itpr2, Mad2l2, Map2k1, Mapk1, Mapk3, Ppp1ca, Ppp2ca, Ppp2cb, Ppp2r1a, Ppp2r5a, Ppp2r5c;mKIAA0044, Ppp2r5e;mKIAA4006, Ppp3ca, Ppp3cb, Prkaca, Prkacb, Pttg1, Rbx1, Rps6ka1, Slk, Smc1a, Smc3, Ywhab, Ywhae, Ywhah, Ywhaq, Ywhaz","14-3-3 gamma;Ywhag, Adcy6, Calm3, Camk2d;Camk2g;mKIAA4163, Fbxw11;mKIAA0696;Btrc;mKIAA4123, Igf1, Map2k1, Ppp2r5e;mKIAA4006, Prkaca, Pttg1, Rps6ka1, Smc1a, Smc3, Ywhab, Ywhae"
KEGG_TIGHT_JUNCTION,56,20,0.958,0.658,0.84,0.81,0.77,0.74,0.72,0.7,0.64,0.65,0.65,1.5,"Actb, Actn1, Actn4, Akt1, Akt2;AK206940, Ash1l, Cask, Cdc42, Cdk4, Cgn, Cldn1, Cldn14, Cldn2, Crb3, Csda, Csnk2a1, Csnk2a2, Csnk2b, Ctnna1;AK008288, Ctnnb1, Cttn, Exoc3, F11r, Gnai2, Gnai3, Llgl2, Magi1, Magi3, Mllt4, Mpp5, Myh10;mKIAA3005, Myh14, Myh9, Myl12b, Nras;Kras, Pard3, Pard6b, Pcp4;Igsf5, Ppp2ca, Ppp2cb, Ppp2r1a, Ppp2r2d;Ppp2r2a, Prkcd, Prkce, Prkci, Prkcz, Pten, Rab13, Rhoa, Rras, Sympk, Tjap1, Tjp1, Tjp2, Tjp3, Vapa","Actb, Actn4, Akt2;AK206940, Cgn, Cldn14, Cldn2, Csnk2a2, Ctnnb1, F11r, Gnai2, Llgl2, Magi3, Pard3, Pard6b, Pcp4;Igsf5, Ppp2r2d;Ppp2r2a, Prkce, Prkcz, Rras, Tjap1"
KEGG_RIG_I_LIKE_RECEPTOR_SIGNALING_PATHWAY,38,10,0.995,0.658,0.76,0.8,0.8,0.84,0.82,0.76,0.75,0.75,0.76,3,"AZ2;Azi2, Atg12, Atg5, Casp8, Chuk, Cxcl10, Cyld, Dak, Ddx3x;Ddx3y, Ddx58, Dhx58;D11lgp2, Fadd, IKKbeta;Ikbkb;Ikkb, Ifih1, Ikbkg, Irf3, Irf7, Isg15, Jnk2;Mapk9, Map3k7, Mapk14, Mavs, Nfkb1, Nfkbia, Nfkbib, Nlrx1, Otud5, Pin1, Rela, Ripk1, Rnf125, Sike1, Tank, Tbk1, Tbkbp1, Tradd, Traf2, Trim25","Atg12, Dak, Irf3, Irf7, Nfkbib, Pin1, Rela, Rnf125, Sike1, Trim25"
KEGG_CYTOSOLIC_DNA_SENSING_PATHWAY,25,6,0.988,0.658,0.89,0.81,0.84,0.83,0.8,0.8,0.77,0.74,0.76,1,"Atrip;Trex1;6620401K05Rik, Ccl5, Chuk, Cxcl10, Ddx58, IKKbeta;Ikbkb;Ikkb, Ikbkg, Il18, Irf3, Irf7, Mavs, Nfkb1, Nfkbia, Nfkbib, Polr1c, Polr1d, Polr3a, Polr3b, Polr3d, Polr3gl, Polr3k, Rela, Ripk1, Tbk1, Zbp1","Atrip;Trex1;6620401K05Rik, Irf3, Irf7, Nfkbib, Polr1c, Rela"
