KEGG_ENDOMETRIAL_CANCER,30,14,0.486,0.513,0.71,0.74,0.7,0.71,0.71,0.67,0.67,0.69,0.74,3,"Akt1, Akt2;AK206940, Apc, Araf, Axin1, Axin2, Bad, Braf, Cdh1;AK041755, Ctnna1;AK008288, Ctnnb1, Egfr, Elk1, Grb2, Gsk3b, Map2k1, Map2k2, Mapk1, Mapk3, Nras;Kras, Pdpk1, Pik3ca, Pik3r1, Pik3r2, Pten, Raf1, Sos1, Sos2;AK138088, Tcf7l1, Tcf7l2","Akt2;AK206940, Araf, Axin2, Cdh1;AK041755, Ctnnb1, Grb2, Gsk3b, Map2k1, Map2k2, Pik3r1, Pik3r2, Raf1, Sos1, Tcf7l1"
KEGG_THYROID_CANCER,19,9,0.431,0.513,0.75,0.69,0.66,0.64,0.68,0.64,0.67,0.69,0.72,2,"Braf, Ccdc6, Cdh1;AK041755, Ctnnb1, Map2k1, Map2k2, Mapk1, Mapk3, Ncoa4, Nras;Kras, Pparg, Rxra, Rxrb, Rxrg, Tcf7l1, Tcf7l2, Tfg, Tpm3, Tpr","Cdh1;AK041755, Ctnnb1, Map2k1, Map2k2, Pparg, Rxra, Rxrb, Tcf7l1, Tpr"
KEGG_AUTOIMMUNE_THYROID_DISEASE,1,0,0.48,0.513,NaN,NaN,NaN,NaN,NaN,NaN,NaN,NaN,NaN,NaN,Fas,
KEGG_ALLOGRAFT_REJECTION,1,0,0.48,0.513,NaN,NaN,NaN,NaN,NaN,NaN,NaN,NaN,NaN,NaN,Fas,
KEGG_GRAFT_VERSUS_HOST_DISEASE,1,0,0.48,0.513,NaN,NaN,NaN,NaN,NaN,NaN,NaN,NaN,NaN,NaN,Fas,
KEGG_LONG_TERM_DEPRESSION,24,11,0.504,0.519,0.76,0.8,0.75,0.76,0.71,0.71,0.65,0.61,0.64,2,"Araf, Braf, Gna11, Gna13, Gnai2, Gnai3, Gnas, Igf1, Itpr1, Itpr2, Lyn, Map2k1, Map2k2, Mapk1, Mapk3, Nras;Kras, Pla2g12a, Pla2g12b, Pla2g6, Plcb1, Ppp2ca, Ppp2cb, Ppp2r1a, Raf1","Araf, Gna11, Gnai2, Igf1, Map2k1, Map2k2, Pla2g12a, Pla2g12b, Pla2g6, Plcb1, Raf1"
KEGG_BASAL_TRANSCRIPTION_FACTORS,20,9,0.518,0.529,0.81,0.82,0.79,0.79,0.69,0.63,0.58,0.56,0.61,2,"Gtf2a1, Gtf2a2, Gtf2b, Gtf2e1, Gtf2f1, Gtf2f2, Gtf2h1;p62, Gtf2h3, Gtf2h4, Gtf2i;Diws1t, Gtf2ird1, Taf1, Taf10, Taf11, Taf12, Taf13, Taf2, Taf5l, Taf7, Taf9","Gtf2f2, Gtf2h1;p62, Gtf2h4, Gtf2i;Diws1t, Gtf2ird1, Taf1, Taf5l, Taf7, Taf9"
KEGG_ADIPOCYTOKINE_SIGNALING_PATHWAY,41,19,0.524,0.531,0.85,0.83,0.83,0.81,0.8,0.78,0.74,0.72,0.72,1,"Acacb, Acsl1, Acsl3;Utp14b, Acsl4;mACS4, Acsl5, Adipor1, Adipor2, Akt1, Akt2;AK206940, Camkk2;mKIAA0787, Chuk, Cpt1a, G6pc, IKKbeta;Ikbkb;Ikkb, Ikbkg, Irs2, Jak2, Jnk2;Mapk9, Mtor, Nfkb1, Nfkbia, Nfkbib, Pck1, Ppara, Prkaa2, Prkab1, Prkag1, Prkag2, Ptpn11, Rela, Rxra, Rxrb, Rxrg, Slc2a1, Socs3, Stat3, Stk11;lkb1, Tnfrsf1a, Tnfrsf1b;AK170464, Tradd, Traf2","Acacb, Acsl4;mACS4, Akt2;AK206940, Camkk2;mKIAA0787, G6pc, Irs2, Mtor, Nfkbib, Pck1, Ppara, Prkag1, Prkag2, Ptpn11, Rela, Rxra, Rxrb, Slc2a1, Stk11;lkb1, Tnfrsf1a"
KEGG_GLYCOLYSIS_GLUCONEOGENESIS,31,14,0.555,0.532,0.65,0.69,0.69,0.71,0.72,0.74,0.77,0.8,0.83,7,"Acss2, Adh4, Adh5, Adh7, Aldh1b1, Aldh2, Aldh3a2, Aldh7a1, Aldh9a1, Aldoa, Aldob, Aldoc, Bpgm, Dlat, Dld, Fbp1, G6pc, Galm, Gapdh, Gck, Gm5506;AK180697;Eno1, Ldha, Pck1, Pdha1, Pdhb, Pfkm, Pgam1, Pgk1, Pgm2, Pklr, Tpi1","Acss2, Aldh1b1, Aldh2, Aldh3a2, Aldh7a1, Aldob, Dlat, Fbp1, G6pc, Gck, Gm5506;AK180697;Eno1, Ldha, Pck1, Pgk1"
KEGG_PENTOSE_PHOSPHATE_PATHWAY,14,6,0.546,0.532,0.76,0.8,0.79,0.8,0.81,0.78,0.82,0.85,0.87,2,"Aldoa, Aldob, Aldoc, Dera, Fam129c;Pgls, Fbp1, H6pd, Pfkm, Pgd, Pgm2, Prps1, Rbks, Taldo1, Tkt","Aldob, Dera, Fam129c;Pgls, Fbp1, H6pd, Taldo1"
KEGG_TGF_BETA_SIGNALING_PATHWAY,33,15,0.548,0.532,0.74,0.77,0.8,0.79,0.7,0.7,0.62,0.61,0.6,2,"Bmpr1a, Bmpr2, Crebbp, Cul1, Dand5;SP1, E2f4, Ep300, Fst, Id1, Id2, Id3, Inhbc, Inhbe, Mapk1, Mapk3, Ppp2ca, Ppp2cb, Ppp2r1a, Rbl2, Rbx1, Rhoa, Rock2;Rock1, Rps6kb1, Rps6kb2, Smad1, Smad3;AK214683, Smad4, Smad5, Smad7, Smad9, Smurf1, Smurf2, Tgfbr1","Ep300, Fst, Id1, Id2, Id3, Inhbc, Inhbe, Rock2;Rock1, Rps6kb1, Smad3;AK214683, Smad5, Smad7, Smad9, Smurf1, Smurf2"
KEGG_GAP_JUNCTION,31,14,0.555,0.532,0.89,0.78,0.75,0.73,0.7,0.68,0.64,0.6,0.61,1,"Adcy6, Adcy9, Csnk1d, Egfr, Gna11, Gnai2, Gnai3, Gnas, Grb2, Itpr1, Itpr2, Map2k1, Map2k2, Map3k2, Mapk1, Mapk3, Mek5;Map2k5, Nras;Kras, Pdgfa, Plcb1, Prkaca, Prkacb, Raf1, Sos1, Sos2;AK138088, Tjp1, Tuba1b, Tuba1c, Tuba8, Tubb2a, Tubb6","Adcy6, Csnk1d, Gna11, Gnai2, Grb2, Map2k1, Map2k2, Plcb1, Prkaca, Raf1, Sos1, Tuba1c, Tuba8, Tubb2a"
KEGG_PATHWAYS_IN_CANCER,140,66,0.551,0.532,0.83,0.77,0.76,0.74,0.71,0.67,0.65,0.67,0.67,2,"AK005414;Lamb3, Abl1, Akt1, Akt2;AK206940, Apc, Appl1, Araf, Arnt;mKIAA4051, Axin1, Axin2, Bad, Bax, Bcl2l1, Bcr, Bid, Braf, Casp8, Cblc, Ccdc6, Cdc42, Cdh1;AK041755, Cdk4, Cdkn1a, Cdkn1b, Cebpa, Chuk, Cks1b, Col4a1, Crebbp, Crk, Csf1r, Ctbp1, Ctnna1;AK008288, Ctnnb1, Cul2, Cycs, DAPK2;Dapk2, Dapk1, Dapk3, E2f3;E2F3, Egfr, Egln1, Egln2, Egln3, Ep300, Epas1, Fadd, Fas, Fgf1, Fgf21, Fgfr3, Fn1, Fos, Foxo1, Fzd1, Fzd8, Grb2, Gsk3b, Gstp1, Hdac1, Hdac2, Hif1a, Hsp90aa1, Hsp90ab1, Hsp90b1, IKKbeta;Ikbkb;Ikkb, Igf1, Ikbkg, Itgb1, Jak1, Jnk2;Mapk9, Jun, Jup, Lamc1, Map2k1, Map2k2, Mapk1, Mapk3, Max, Mdm2, Met;Sltm, Miz1;Pias2, Msh2, Mtor, Ncoa4, Nfkb1, Nfkbia, Nras;Kras, Pdgfa, Pias1, Pias4;PIAS-gamma, Pik3ca, Pik3r1, Pik3r2, Plcg1;AK169777, Pml, Ppard, Pparg, Ptch1, Pten, Ptk2;FAK, Rac1, Rac2, Raf1, Rala, Ralb, Ralbp1, Rara, Rbx1, Rela, Rhoa, Rxra, Rxrb, Rxrg, Slc2a1, Smad3;AK214683, Smad4, Sos1, Sos2;AK138088, Stat1, Stat3, Stat5a, Stat5b;AK088966, Stk4, Tceb1, Tceb2, Tcf7l1, Tcf7l2, Tfg, Tgfbr1, Tpm3, Tpr, Traf2, Traf4, Vegfa, Vegfb, Vhl, Wnt5b, Xiap, Zbtb16","Abl1, Akt2;AK206940, Araf, Arnt;mKIAA4051, Axin2, Bcl2l1, Bcr, Cblc, Cdh1;AK041755, Cebpa, Col4a1, Crk, Csf1r, Ctbp1, Ctnnb1, Cycs, Dapk3, Egln3, Ep300, Fn1, Fos, Foxo1, Fzd8, Grb2, Gsk3b, Gstp1, Hdac2, Hsp90aa1, Hsp90ab1, Hsp90b1, Igf1, Itgb1, Jun, Map2k1, Map2k2, Max, Mdm2, Met;Sltm, Mtor, Pias4;PIAS-gamma, Pik3r1, Pik3r2, Plcg1;AK169777, Pparg, Ptk2;FAK, Rac1, Raf1, Rala, Ralbp1, Rara, Rela, Rxra, Rxrb, Slc2a1, Smad3;AK214683, Sos1, Stat5a, Stat5b;AK088966, Tcf7l1, Tpr, Traf4, Vegfb, Vhl, Wnt5b, Xiap, Zbtb16"
KEGG_COLORECTAL_CANCER,33,15,0.548,0.532,0.67,0.72,0.68,0.69,0.67,0.64,0.65,0.7,0.75,4,"Akt1, Akt2;AK206940, Apc, Appl1, Araf, Axin1, Axin2, Bad, Bax, Braf, Ctnnb1, Cycs, Fos, Gsk3b, Jnk2;Mapk9, Jun, Map2k1, Mapk1, Mapk3, Msh2, Nras;Kras, Pik3ca, Pik3r1, Pik3r2, Rac1, Rac2, Raf1, Rhoa, Smad3;AK214683, Smad4, Tcf7l1, Tcf7l2, Tgfbr1","Akt2;AK206940, Araf, Axin2, Ctnnb1, Cycs, Fos, Gsk3b, Jun, Map2k1, Pik3r1, Pik3r2, Rac1, Raf1, Smad3;AK214683, Tcf7l1"
KEGG_SMALL_CELL_LUNG_CANCER,35,16,0.542,0.532,0.87,0.83,0.83,0.78,0.74,0.7,0.67,0.69,0.67,1.5,"AK005414;Lamb3, Akt1, Akt2;AK206940, Bcl2l1, Cdk4, Cdkn1b, Chuk, Cks1b, Col4a1, Cycs, E2f3;E2F3, Fhit, Fn1, IKKbeta;Ikbkb;Ikkb, Ikbkg, Itgb1, Lamc1, Max, Miz1;Pias2, Nfkb1, Nfkbia, Pias1, Pias4;PIAS-gamma, Pik3ca, Pik3r1, Pik3r2, Pten, Ptk2;FAK, Rela, Rxra, Rxrb, Rxrg, Traf2, Traf4, Xiap","Akt2;AK206940, Bcl2l1, Col4a1, Cycs, Fn1, Itgb1, Max, Pias4;PIAS-gamma, Pik3r1, Pik3r2, Ptk2;FAK, Rela, Rxra, Rxrb, Traf4, Xiap"
KEGG_GLYCOSAMINOGLYCAN_BIOSYNTHESIS_HEPARAN_SULFATE,10,4,0.574,0.533,0.88,0.79,0.86,0.81,0.72,0.68,0.65,0.61,0.64,1,"AK043361;Glce, B3gat3, Ext1, Ext2, Extl3, Hs3st3b1, Hs6st1, Ndst1, Ndst2, Xylt2","Hs3st3b1, Hs6st1, Ndst2, Xylt2"
KEGG_DORSO_VENTRAL_AXIS_FORMATION,10,4,0.574,0.533,0.94,0.91,0.9,0.87,0.82,0.73,0.74,0.73,0.76,2,"Egfr, Ets2, Etv6, Grb2, Map2k1, Mapk1, Mapk3, Nras;Kras, Sos1, Sos2;AK138088","Ets2, Grb2, Map2k1, Sos1"
KEGG_NON_SMALL_CELL_LUNG_CANCER,27,12,0.571,0.533,0.79,0.9,0.87,0.88,0.83,0.77,0.75,0.73,0.74,2.5,"Akt1, Akt2;AK206940, Araf, Bad, Braf, Cdk4, E2f3;E2F3, Egfr, Fhit, Grb2, Map2k1, Map2k2, Mapk1, Mapk3, Nras;Kras, Pdpk1, Pik3ca, Pik3r1, Pik3r2, Plcg1;AK169777, Raf1, Rxra, Rxrb, Rxrg, Sos1, Sos2;AK138088, Stk4","Akt2;AK206940, Araf, Grb2, Map2k1, Map2k2, Pik3r1, Pik3r2, Plcg1;AK169777, Raf1, Rxra, Rxrb, Sos1"
KEGG_PRIMARY_IMMUNODEFICIENCY,10,4,0.574,0.533,0.71,0.65,0.68,0.69,0.65,0.6,0.56,0.51,0.48,2.5,"Dclre1c, Ikbkg, Rag1;B230118H07Rik, Rfx5, Rfxank, Rfxap, Tap1, Tap2, Ung, Zap70","Dclre1c, Rag1;B230118H07Rik, Rfxap, Zap70"
KEGG_AMINO_SUGAR_AND_NUCLEOTIDE_SUGAR_METABOLISM,21,9,0.6,0.537,0.93,0.83,0.79,0.71,0.69,0.66,0.63,0.62,0.6,2,"AK084646;Nagk;AK051368, Amdhd2, Cmas, Cyb5r3, Gale, Galk1, Galt, Gck, Gfpt1, Gmppa, Gne, Hexa, Mpi;Pmi, Nans, Pgm2, Pmm1, Pmm2, Tsta3, Uap1, Ugdh, Ugp2","Cmas, Galt, Gck, Gne, Hexa, Pmm1, Pmm2, Tsta3, Ugdh"
KEGG_GLYCEROPHOSPHOLIPID_METABOLISM,40,18,0.589,0.537,0.88,0.88,0.84,0.81,0.74,0.7,0.69,0.7,0.69,1,"Agpat2, Agpat3, Agpat6, Agpat9, Cdipt, Cds2, Chka, Chkb, Chpt1, Crls1, Dgkd;mKIAA0145, Dgkz, Etnk1, Etnk2, Gnpat, Gpd1, Gpd1l, Gpd2, Lcat, Lclat1, Lpcat3, Lpgat1, Lpla2;Pla2g15, Lypla1, Lypla2, Mboat7, Pcyt1a, Pcyt2, Pemt, Phospho1;Zfp652, Pisd, Pla2g12a, Pla2g12b, Pla2g6, Ppap2b, Ppap2c, Ptdss1, Ptdss2, Taz, mKIAA1560;Gpam","Agpat6, Cds2, Chkb, Chpt1, Etnk1, Etnk2, Gnpat, Gpd2, Lcat, Lypla2, Pcyt1a, Pemt, Phospho1;Zfp652, Pla2g12a, Pla2g12b, Pla2g6, Ppap2b, Ptdss1"
KEGG_TERPENOID_BACKBONE_BIOSYNTHESIS,8,3,0.593,0.537,0.92,0.9,0.96,0.92,0.89,0.82,0.83,0.84,0.81,3,"Acat1, Acat2, Dhdds, Fdps, Hmgcr, Hmgcs2, Mvk, Pmvk","Acat1, Fdps, Hmgcs2"
KEGG_NATURAL_KILLER_CELL_MEDIATED_CYTOTOXICITY,36,16,0.604,0.537,0.73,0.8,0.76,0.78,0.77,0.76,0.71,0.69,0.68,2,"Araf, Bid, Braf, Fas, Grb2, H1f0;Icam1, Ifnar1, Ifnar2, Ifngr1, Ifngr2, Map2k1, Map2k2, Mapk1, Mapk3, Nfatc1, Nfatc3, Nras;Kras, Pak1;Pak2, Pik3ca, Pik3r1, Pik3r2, Plcg1;AK169777, Ppp3ca, Ppp3cb, Ptk2b, Ptpn11, Ptpn6, Rac1, Rac2, Raf1, Sh3bp2, Shc1, Sos1, Sos2;AK138088, Tyrobp, Zap70","Araf, Grb2, H1f0;Icam1, Map2k1, Map2k2, Pik3r1, Pik3r2, Plcg1;AK169777, Ptk2b, Ptpn11, Rac1, Raf1, Shc1, Sos1, Tyrobp, Zap70"
KEGG_REGULATION_OF_ACTIN_CYTOSKELETON,80,37,0.583,0.537,0.86,0.81,0.76,0.79,0.74,0.73,0.69,0.67,0.68,1,"Actb, Actn1, Actn4, Apc, Araf, Arhgef12, Arhgef1;mFLJ00369, Arhgef7, Arpc1a;Sid329, Arpc1b, Arpc2, Arpc3, Arpc4;Ttll3, Arpc5, Arpc5l, Baiap2, Bcar1, Braf, Cdc42, Cfl1, Cfl2, Crk, Csk, Cyfip1;Shyc, Dock1, Egfr, F2, Fgf1, Fgf21, Fgfr3, Fgfr4, Fn1, Git1, Gna13, Gng12, Iqgap1, Iqgap2, Itga5, Itgb1, Itgb5, Map2k1, Map2k2, Mapk1, Mapk3, Myh10;mKIAA3005, Myh14, Myh9, Myl12b, Mylk;Mlyk, Nckap1, Nras;Kras, Pak1;Pak2, Pak4, Pdgfa, Pelo;Pelota;Itga1, Pfn1, Pik3ca, Pik3r1, Pik3r2, Pikfyve, Pip4k2b, Pip5k1a, Pip5k1c, Ppp1ca, Ppp1r12a, Ptk2;FAK, Pxn, Rac1, Rac2, Raf1, Rdx;BC147413, Rhoa, Rock2;Rock1, Rras, Sos1, Sos2;AK138088, Tmsb4x, Vcl, Wasf2;AK199358, Wasl","Actb, Actn4, Araf, Arhgef12, Arhgef1;mFLJ00369, Arhgef7, Arpc3, Baiap2, Bcar1, Cfl1, Cfl2, Crk, Csk, F2, Fn1, Gng12, Iqgap2, Itgb1, Map2k1, Map2k2, Mylk;Mlyk, Nckap1, Pelo;Pelota;Itga1, Pik3r1, Pik3r2, Pip5k1a, Ppp1r12a, Ptk2;FAK, Pxn, Rac1, Raf1, Rdx;BC147413, Rock2;Rock1, Rras, Sos1, Tmsb4x, Wasf2;AK199358"
KEGG_ARRHYTHMOGENIC_RIGHT_VENTRICULAR_CARDIOMYOPATHY_ARVC,21,9,0.6,0.537,0.74,0.8,0.78,0.76,0.76,0.72,0.73,0.75,0.8,3,"Actb, Actn1, Actn4, Atp2a2, Cdh2, Ctnna1;AK008288, Ctnnb1, Dag1, Dsc2, Dsg2, Dsp, Emd, Itga5, Itgb1, Itgb5, Jup, Lmna, Pelo;Pelota;Itga1, Pkp2, Tcf7l1, Tcf7l2","Actb, Actn4, Cdh2, Ctnnb1, Emd, Itgb1, Lmna, Pelo;Pelota;Itga1, Tcf7l1"
KEGG_TASTE_TRANSDUCTION,6,2,0.619,0.546,0.82,0.76,0.74,0.66,0.61,0.69,0.55,0.52,0.67,5,"Adcy6, Gnas, Gnb1, Prkaca, Prkacb, Scnn1a","Adcy6, Prkaca"
KEGG_SPHINGOLIPID_METABOLISM,15,6,0.641,0.557,0.86,0.83,0.81,0.76,0.74,0.8,0.75,0.71,0.72,1,"Arsa, Asah1, Degs1, Gba, Glb1;Tmppe, Kdsr, Neu1, Ppap2b, Ppap2c, Sgms2, Sgpl1;mKIAA1252, Sgpp1, Smpd4;mKIAA1418, Sptlc1, Sptlc2","Arsa, Kdsr, Neu1, Ppap2b, Sgpl1;mKIAA1252, Sgpp1"
KEGG_WNT_SIGNALING_PATHWAY,58,26,0.64,0.557,0.8,0.75,0.75,0.71,0.72,0.67,0.63,0.64,0.67,2,"Apc, Axin1, Axin2, Cacybp, Camk2b, Camk2d;Camk2g;mKIAA4163, Chd8, Crebbp, Csnk1a1, Csnk2a1, Csnk2a2, Csnk2b, Ctbp1, Ctnnb1, Ctnnbip1, Cul1, Daam1;mKIAA0666, Ep300, Fbxw11;mKIAA0696;Btrc;mKIAA4123, Frat1, Fzd1, Fzd8, Gsk3b, Jnk2;Mapk9, Jun, Lrp5, Lrp6, Map3k7, Nfatc1, Nfatc3, Nlk, Plcb1, Ppard, Ppp2ca, Ppp2cb, Ppp2r1a, Ppp2r5a, Ppp2r5c;mKIAA0044, Ppp2r5e;mKIAA4006, Ppp3ca, Ppp3cb, Prkaca, Prkacb, Psen1, Rac1, Rac2, Rbx1, Rhoa, Rock2;Rock1, Ruvbl1, Senp2, Smad3;AK214683, Smad4, Tbl1x, Tbl1xr1, Tcf7l1, Tcf7l2, Wnt5b","Axin2, Camk2d;Camk2g;mKIAA4163, Csnk1a1, Csnk2a2, Ctbp1, Ctnnb1, Ctnnbip1, Daam1;mKIAA0666, Ep300, Fbxw11;mKIAA0696;Btrc;mKIAA4123, Frat1, Fzd8, Gsk3b, Jun, Lrp5, Plcb1, Ppp2r5e;mKIAA4006, Prkaca, Rac1, Rock2;Rock1, Ruvbl1, Senp2, Smad3;AK214683, Tbl1x, Tcf7l1, Wnt5b"
KEGG_MELANOMA,26,11,0.65,0.562,0.71,0.79,0.74,0.77,0.74,0.74,0.73,0.74,0.76,2,"Akt1, Akt2;AK206940, Araf, Bad, Braf, Cdh1;AK041755, Cdk4, Cdkn1a, E2f3;E2F3, Egfr, Fgf1, Fgf21, Igf1, Map2k1, Map2k2, Mapk1, Mapk3, Mdm2, Met;Sltm, Nras;Kras, Pdgfa, Pik3ca, Pik3r1, Pik3r2, Pten, Raf1","Akt2;AK206940, Araf, Cdh1;AK041755, Igf1, Map2k1, Map2k2, Mdm2, Met;Sltm, Pik3r1, Pik3r2, Raf1"
KEGG_ONE_CARBON_POOL_BY_FOLATE,13,5,0.659,0.565,0.56,0.7,0.75,0.81,0.81,0.84,0.75,0.75,0.79,6,"Aldh1l1, Atic, Dhfr, Ftcd, Gart, Mtfmt, Mthfd1, Mthfd2l, Mthfr, Mthfs, Shmt1, Shmt2, Tyms","Aldh1l1, Ftcd, Gart, Mthfd2l, Mthfr"
KEGG_GLYCOSYLPHOSPHATIDYLINOSITOL_GPI_ANCHOR_BIOSYNTHESIS,11,4,0.68,0.575,0.91,0.77,0.74,0.73,0.63,0.62,0.65,0.67,0.72,1,"Dpm2, Gpaa1, Gpld1, Pigc, Pigk, Pigo, Pigp, Pigs, Pigu, Pigx, Pigy","Dpm2, Gpaa1, Pigp, Pigu"
KEGG_NOTCH_SIGNALING_PATHWAY,20,8,0.689,0.575,0.84,0.81,0.78,0.75,0.72,0.71,0.66,0.67,0.72,1,"Aph1a, Crebbp, Ctbp1, Dtx2, Dtx3l, Dtx4, Ep300, Hdac1, Hdac2, Hes1, Kat2a, Kat2b, Maml1, Ncor2, Ncstn, Psen1, Psen2, Psenen, Rfng;radical-fringe, Snw1","Aph1a, Ctbp1, Dtx3l, Dtx4, Ep300, Hdac2, Ncor2, Snw1"
KEGG_T_CELL_RECEPTOR_SIGNALING_PATHWAY,46,20,0.681,0.575,0.82,0.85,0.84,0.83,0.81,0.74,0.73,0.71,0.71,2,"AK171687;Bcl10, Akt1, Akt2;AK206940, Cblc, Cdc42, Cdk4, Chuk, Dlg1;mKIAA4187, Fos, Grb2, Gsk3b, IKKbeta;Ikbkb;Ikkb, Ikbkg, Jnk2;Mapk9, Jun, Map2k1, Map2k2, Map2k7, Map3k7, Mapk1, Mapk14, Mapk3, Nck1, Nfatc1, Nfatc3, Nfkb1, Nfkbia, Nfkbib, Nras;Kras, Pak1;Pak2, Pak4, Pdk1, Pik3ca, Pik3r1, Pik3r2, Plcg1;AK169777, Ppp3ca, Ppp3cb, Ptpn6, Raf1, Rela, Rhoa, Sos1, Sos2;AK138088, Tec, Zap70","AK171687;Bcl10, Akt2;AK206940, Cblc, Fos, Grb2, Gsk3b, Jun, Map2k1, Map2k2, Map2k7, Nck1, Nfkbib, Pdk1, Pik3r1, Pik3r2, Plcg1;AK169777, Raf1, Rela, Sos1, Zap70"
KEGG_FC_GAMMA_R_MEDIATED_PHAGOCYTOSIS,44,19,0.689,0.575,0.82,0.81,0.78,0.81,0.73,0.71,0.7,0.66,0.65,2,"Akt1, Akt2;AK206940, Arpc1a;Sid329, Arpc1b, Arpc2, Arpc3, Arpc4;Ttll3, Arpc5, Arpc5l, Asap1;Shag1, Asap3, Cdc42, Cfl1, Cfl2, Crk, Dnm1l;Drp1, Dnm2, Lyn, Map2k1, Mapk1, Mapk3, Myo10;myo 10, Pak1;Pak2, Pik3ca, Pik3r1, Pik3r2, Pikfyve, Pip4k2b, Pip5k1a, Pip5k1c, Pla2g6, Plcg1;AK169777, Ppap2b, Ppap2c, Prkcd, Prkce, Rac1, Rac2, Raf1, Rps6kb1, Rps6kb2, Vasp, Wasf2;AK199358, Wasl","Akt2;AK206940, Arpc3, Cfl1, Cfl2, Crk, Dnm2, Map2k1, Myo10;myo 10, Pik3r1, Pik3r2, Pip5k1a, Pla2g6, Plcg1;AK169777, Ppap2b, Prkce, Rac1, Raf1, Rps6kb1, Wasf2;AK199358"
KEGG_FOLATE_BIOSYNTHESIS,7,2,0.74,0.591,0.89,0.93,0.99,0.93,0.85,0.69,0.65,0.68,0.69,3.5,"Alpl, Dhfr, Fpgs, Gch1, Pts, Qdpr, Spr","Fpgs, Gch1"
KEGG_SPLICEOSOME,107,48,0.714,0.591,0.87,0.81,0.79,0.8,0.77,0.7,0.68,0.68,0.69,2,"Acin1, Aqr;mKIAA0560, BC033430;Hnrnpu;AK049600, Bcas2, Bud31, Ccdc12, Cdc40, Cdc5l;mKIAA0432, Crnkl1, Ctnnbl1, Cwc15, Ddx23, Ddx42, Ddx46, Ddx5;Mir3064, Dhx15;mDEAH9, Dhx16, Dhx38, Dhx8, Eftud2;mKIAA0031, Eif4a3, Hnrnpa1, Hnrnpc, Hnrnpk;Hnrpk, Hnrnpm;mKIAA4193, Hspa1b, Hspa8, Isy1, Lsm2;SmX5, Lsm4, Lsm6, Magohb, Naa38, Ncbp1, Ncbp2, Nhp2l1, PLRG1;Plrg1, Pcbp1, Phf5a, Ppie, Ppil1, Pqbp1, Prpf18, Prpf19, Prpf31, Prpf38a, Prpf38b, Prpf3;AK084028, Prpf4, Prpf40a;FBP11, Prpf40b, Prpf6, Prpf8, Puf60, Rbm17, Rbm22, Rbm25, Rbm8a, Sart1, Sf3a1, Sf3a2, Sf3a3, Sf3b1, Sf3b2, Sf3b3, Sf3b4, Sf3b5, Sfrs3;Srsf3, Sfrs7;Srsf7, Sfswap;Srsf8, Slu7, Smndc1, Snrnp200, Snrnp27, Snrnp40, Snrnp70, Snrpa, Snrpa1, Snrpb, Snrpb2, Snrpc, Snrpd1, Snrpd2, Snrpd3, Snrpe, Snrpf, Snrpg, Snw1, Srsf1, Srsf10;nssr 1, Srsf2, Srsf5, Srsf6, Srsf9, Syf2, Tcerg1, Thoc2;BC005561, Thoc3, Thoc4, Tra2b, Txnl4a;Naa10, U2af1, U2af2, Usp39, Wbp11, Xab2, Zmat2","Acin1, BC033430;Hnrnpu;AK049600, Bcas2, Ccdc12, Ctnnbl1, Cwc15, Ddx42, Dhx38, Dhx8, Eftud2;mKIAA0031, Eif4a3, Hnrnpa1, Hnrnpm;mKIAA4193, Hspa1b, Hspa8, Isy1, PLRG1;Plrg1, Ppil1, Pqbp1, Prpf19, Prpf31, Prpf38b, Prpf4, Prpf40b, Prpf6, Prpf8, Puf60, Rbm25, Sart1, Sf3a1, Sf3a2, Sf3b1, Sf3b2, Sf3b4, Sfrs7;Srsf7, Smndc1, Snrnp200, Snrnp40, Snrpa, Snrpd1, Snrpd2, Snrpe, Snrpf, Snrpg, Snw1, Syf2, Tcerg1, Thoc4"
KEGG_REGULATION_OF_AUTOPHAGY,14,5,0.743,0.591,0.83,0.91,0.92,0.92,0.88,0.77,0.75,0.75,0.7,2,"Atg12, Atg3, Atg4b, Atg5, Atg7, Becn1, Gabarap, Gabarapl1, Gabarapl2, Pik3c3, Pik3r4, Prkaa2, Ulk1, Ulk2","Atg12, Gabarap, Gabarapl1, Pik3c3, Ulk1"
KEGG_TOLL_LIKE_RECEPTOR_SIGNALING_PATHWAY,45,19,0.736,0.591,0.81,0.81,0.82,0.83,0.83,0.79,0.78,0.78,0.81,3,"Akt1, Akt2;AK206940, Casp8, Ccl5, Chuk, Cxcl10, Cxcl9, Fadd, Fos, IKKbeta;Ikbkb;Ikkb, IRAK1-S;Irak1;Mir718, Ifnar1, Ifnar2, Ikbkg, Irak4, Irf3, Irf5, Irf7, Jnk2;Mapk9, Jun, Lbp, Map2k1, Map2k2, Map2k3, Map2k4, Map2k7, Map3k7, Mapk1, Mapk14, Mapk3, Myd88, Nfkb1, Nfkbia, Pik3ca, Pik3r1, Pik3r2, Rac1, Rela, Ripk1, Stat1, Tab2, Tbk1, Ticam1, Tirap, Tollip","Akt2;AK206940, Fos, IRAK1-S;Irak1;Mir718, Irf3, Irf5, Irf7, Jun, Map2k1, Map2k2, Map2k3, Map2k4, Map2k7, Myd88, Pik3r1, Pik3r2, Rac1, Rela, Tab2, Tollip"
KEGG_TYPE_I_DIABETES_MELLITUS,2,0,0.73,0.591,NaN,NaN,NaN,NaN,NaN,NaN,NaN,NaN,NaN,NaN,"Fas, Hspd1",
KEGG_VASOPRESSIN_REGULATED_WATER_REABSORPTION,25,10,0.727,0.591,0.86,0.87,0.84,0.84,0.81,0.78,0.72,0.69,0.74,2,"Adcy6, Adcy9, Arhgdia, Creb1, Creb3l2, Creb3l3, Dctn1, Dctn4, Dctn5;Plk1, Dctn6, Dync1h1, Dync1i2;Dncic2, Dync1li2, Dynll1, Dynll2;Gdi-1, Gnas, Nsf;AK160502, Prkaca, Prkacb, Rab11a, Rab11b, Rab5a, Rab5b, Rab5c, Vamp2","Adcy6, Arhgdia, Creb3l2, Dctn4, Dync1h1, Dynll2;Gdi-1, Prkaca, Rab11b, Rab5a, Rab5c"
KEGG_LEISHMANIA_INFECTION,23,9,0.74,0.591,0.8,0.77,0.8,0.79,0.82,0.8,0.79,0.78,0.84,3,"C3, Elk1, Fos, IRAK1-S;Irak1;Mir718, Ifngr1, Ifngr2, Irak4, Itgb1, Jak1, Jak2, Jun, Map3k7, Mapk1, Mapk14, Mapk3, Myd88, Nfkb1, Nfkbia, Nfkbib, Ptpn6, Rela, Stat1, Tab2","C3, Fos, IRAK1-S;Irak1;Mir718, Itgb1, Jun, Myd88, Nfkbib, Rela, Tab2"
KEGG_BLADDER_CANCER,21,8,0.755,0.598,0.72,0.73,0.67,0.72,0.7,0.7,0.67,0.69,0.76,3,"Araf, Braf, Cdh1;AK041755, Cdk4, Cdkn1a, DAPK2;Dapk2, Dapk1, Dapk3, E2f3;E2F3, Egfr, Fgfr3, Map2k1, Map2k2, Mapk1, Mapk3, Mdm2, Nras;Kras, Raf1, Tymp, Vegfa, Vegfb","Araf, Cdh1;AK041755, Dapk3, Map2k1, Map2k2, Mdm2, Raf1, Vegfb"
KEGG_LYSOSOME,83,36,0.772,0.603,0.81,0.82,0.81,0.81,0.78,0.76,0.75,0.74,0.73,2,"AK081796;Gns, AK182549;Slc11a2;Nramp2, Abca2;Mir3087, Acp5, Aga, Ap1b1, Ap1g1, Ap1m1, Ap1s1, Ap3b1, Ap3d1, Ap3m1, Ap3s1, Ap3s2, Ap4b1, Ap4e1, Ap4s1, Arsa, Arsb, Arsg, Asah1, Atp6ap1, Atp6v0a1, Atp6v0b, Atp6v0c, Atp6v0d1, Atp6v1h, Cd164, Cln3, Cln5, Clta, Cltb, Cltc;AK049578, Ctsa, Ctsb, Ctsc, Ctsd, Ctsf, Ctsh, Ctso, Ctss, Ctsz, Dnase2b, Fuca1, Gaa, Galns, Gba, Gga1, Gga2;mKIAA1080, Glb1;Tmppe, Gm2a, Gnptg, Gusb, Hexa, Hgsnat, Hyal1;Nat6;Hyal3, Igf2r, Lamp1, Lamp2, Laptm4a, Laptm4b, Laptm5;AK171116, Lgmn, Lipa, Lpla2;Pla2g15, M6pr, Man2b1, Mcoln1, Naga, Naglu, Nagpa, Neu1, Npc1, Npc2, Ppt1, Ppt2, Psap, Scarb2, Slc17a5, Sort1, Sumf1, Tcirg1, Tpp1","Abca2;Mir3087, Acp5, Ap1b1, Ap1m1, Ap3b1, Ap3d1, Ap3m1, Ap3s2, Arsa, Arsg, Atp6v0a1, Atp6v0c, Atp6v0d1, Atp6v1h, Cd164, Cln3, Cltb, Ctsb, Ctsc, Ctsd, Ctsf, Gaa, Gm2a, Hexa, Hgsnat, Hyal1;Nat6;Hyal3, Igf2r, Lamp1, Lipa, Man2b1, Nagpa, Neu1, Npc1, Slc17a5, Sort1, Tcirg1"
KEGG_ENDOCYTOSIS,96,42,0.771,0.603,0.87,0.77,0.76,0.74,0.71,0.69,0.66,0.64,0.62,1.5,"Acap2, Adrbk1, Agap1;mKIAA1099, Ap2a1, Ap2a2;mKIAA0899, Ap2b1, Ap2m1, Ap2s1, Arap1, Arap2, Arfgap1, Arrb2, Asap1;Shag1, Asap3, Cblc, Cdc42, Chmp1b, Chmp2a, Chmp2b, Chmp4b, Chmp5, Clta, Cltb, Cltc;AK049578, Csf1r, Dnm1l;Drp1, Dnm2, Eea1, Egfr, Ehd1, Epn1, Eps15, Fam125a, Fgfr3, Fgfr4, Git1, Git2, Grk6;GRK6, Hgs, Hspa1b, Hspa8, Iqsec1, Iqsec2, Itch, Ldlr, Ldlrap1, Mdm2, Met;Sltm, Nedd4, Pard3, Pard6b, Pdcd6ip, Pikfyve, Pip4k2b, Pip5k1a, Pip5k1c, Prkci, Prkcz, Psd3, Rab11a, Rab11b, Rab11fip1;mFLJ00294, Rab11fip2, Rab11fip3, Rab22A;Rab22a, Rab4a, Rab5a, Rab5b, Rab5c, Rabep1, Ramp2;Vps25, Rufy1, Sh3glb1;AK086477, Sh3glb2, Smap1, Smap2, Smurf1, Smurf2, Snf8, Stam, Stam2, Stambp, Tsg101, Usp8;mUBPY, Vps28, Vps36, Vps37a, Vps37b, Vps37c, Vps45, Vps4a, Vps4b, Vta1, Wwp1, Zfyve20, mKIAA0439;Nedd4l","Adrbk1, Ap2a2;mKIAA0899, Arap1, Arap2, Arrb2, Cblc, Chmp4b, Cltb, Csf1r, Dnm2, Eea1, Ehd1, Git2, Grk6;GRK6, Hspa1b, Hspa8, Iqsec2, Mdm2, Met;Sltm, Nedd4, Pard3, Pard6b, Pip5k1a, Prkcz, Rab11b, Rab11fip1;mFLJ00294, Rab11fip2, Rab11fip3, Rab5a, Rab5c, Rabep1, Rufy1, Sh3glb1;AK086477, Smap2, Smurf1, Smurf2, Stam2, Tsg101, Usp8;mUBPY, Vps37b, Vps4b, Vta1"
KEGG_NON_HOMOLOGOUS_END_JOINING,5,1,0.787,0.611,1,0.87,0.89,0.59,0.38,0.14,0.1,0.11,0.11,1,"Dclre1c, Lig4, Rad50, Xrcc5, Xrcc6",Dclre1c
KEGG_GALACTOSE_METABOLISM,13,4,0.834,0.643,0.81,0.87,0.87,0.85,0.85,0.9,0.83,0.79,0.76,2.5,"B4galt1, Capn3;Ganc;mFLJ00088, G6pc, Gaa, Gale, Galk1, Galt, Gck, Glb1;Tmppe, Mgam, Pfkm, Pgm2, Ugp2","G6pc, Gaa, Galt, Gck"
KEGG_PURINE_METABOLISM,71,29,0.865,0.644,0.89,0.78,0.75,0.72,0.68,0.64,0.64,0.63,0.61,1,"Adcy6, Adcy9, Adk, Adsl, Adss, Adssl1, Ak2, Ak4, Ampd2, Aprt;aprt, Atic, Cant1, Dguok, Enpp1, Enpp3, Entpd5, Entpd6, Fhit, Gart, Gda, Gmpr2, Gmps, Guk1, Itpa, Nme1, Nme2, Nme3, Nme6, Npr2, Nt5c, Nt5c2, Nt5e, Nt5m;Dnt2, Nudt2, Nudt9, Paics, Papss1, Papss2, Pde3b, Pde6d, Pde9a, Pklr, Pnp, Pold3, Pold4, Pole3, Pole4, Polr1a, Polr1b, Polr1c, Polr1d, Polr2b, Polr2d, Polr2e, Polr2f, Polr2g, Polr2h, Polr2i, Polr2j, Polr2l, Polr3a, Polr3b, Polr3d, Polr3gl, Polr3k, Ppat, Prhoxnb, Prps1, Prune, Xdh, Znrd1","Adcy6, Adk, Adss, Adssl1, Ak4, Cant1, Dguok, Enpp1, Enpp3, Entpd5, Gart, Gda, Guk1, Nme2, Npr2, Nt5c2, Nt5e, Nudt9, Paics, Papss2, Pde6d, Pnp, Pold4, Polr1b, Polr1c, Polr2i, Polr2j, Prune, Xdh"
KEGG_PYRIMIDINE_METABOLISM,58,23,0.875,0.644,0.85,0.83,0.83,0.79,0.77,0.68,0.67,0.66,0.67,2,"Ak3, Cad, Cant1, Cda, Cmpk1, Dhodh, Dpyd, Dpys, Dtymk, Dut;Dutp, Entpd5, Entpd6, Itpa, Nme1, Nme2, Nme3, Nme6, Nt5c, Nt5c2, Nt5e, Nt5m;Dnt2, Nudt2, Pnp, Pold3, Pold4, Pole3, Pole4, Polr1a, Polr1b, Polr1c, Polr1d, Polr2b, Polr2d, Polr2e, Polr2f, Polr2g, Polr2h, Polr2i, Polr2j, Polr2l, Polr3a, Polr3b, Polr3d, Polr3gl, Polr3k, Tk1, Tk2, Txnrd1, Txnrd2;TXNRD2, Tymp, Tyms, Uck1, Uck2, Uckl1, Umps, Upb1, Upp2, Znrd1","Ak3, Cant1, Cda, Cmpk1, Dpyd, Dtymk, Entpd5, Nme2, Nt5c2, Nt5e, Pnp, Pold4, Polr1b, Polr1c, Polr2i, Polr2j, Tk2, Txnrd1, Txnrd2;TXNRD2, Uck1, Uckl1, Upb1, Upp2"
KEGG_VALINE_LEUCINE_AND_ISOLEUCINE_BIOSYNTHESIS,9,2,0.889,0.644,1,0.92,0.83,0.77,0.77,0.79,0.82,0.76,0.78,1,"Bcat2, Iars, Iars2, Kiaa0028;Lars2, Lars, Pdha1, Pdhb, Vars, Vars2","Lars, Vars"
KEGG_GLYCOSAMINOGLYCAN_BIOSYNTHESIS_KERATAN_SULFATE,6,1,0.871,0.644,0.63,1,1,0.84,0.7,0.68,0.65,0.69,0.73,3,"B3gnt1;Brms1, B4galt1, B4galt3, Commd1;B3gnt2, St3gal1;AK169958, St3gal3",B4galt3
KEGG_INOSITOL_PHOSPHATE_METABOLISM,27,9,0.911,0.644,0.76,0.7,0.71,0.78,0.79,0.73,0.73,0.68,0.66,4,"AK051424;Inpp4a, Aldh6a1, Cdipt, Impa1, Impa2, Inpp1, Inpp5b;INPP5P;Mir698, Inpp5k, Ipmk;AK076771, Ippk, Isyna1, Itpk1, Minpp1, PLC-epsilon;Plce1, Pi4ka;Pik4ca, Pik3c2a, Pik3c3, Pik3ca, Pikfyve, Pip4k2b, Pip5k1a, Pip5k1c, Plcb1, Plcg1;AK169777, Pten, Synj1, Tpi1","Impa1, Impa2, Ipmk;AK076771, PLC-epsilon;Plce1, Pi4ka;Pik4ca, Pik3c3, Pip5k1a, Plcb1, Plcg1;AK169777"
KEGG_GLYCOSPHINGOLIPID_BIOSYNTHESIS_LACTO_AND_NEOLACTO_SERIES,7,1,0.924,0.644,0.63,1,1,0.84,0.7,0.68,0.65,0.69,0.73,3,"B3galt1, B3gnt1;Brms1, B4galt1, B4galt3, Commd1;B3gnt2, St3gal3, St3gal4",B4galt3
KEGG_DNA_REPLICATION,17,5,0.904,0.644,0.92,0.72,0.7,0.71,0.72,0.68,0.64,0.62,0.65,1,"Mcm7, Pcna, Pold3, Pold4, Pole3, Pole4, Rfc1, Rfc2, Rfc3, Rfc5, Rnaseh1;Rnh1, Rnaseh2a, Rnaseh2b, Rnaseh2c, Rpa2, Rpa3, Ssbp1","Pold4, Rfc1, Rnaseh2a, Rnaseh2b, Rnaseh2c"
KEGG_HOMOLOGOUS_RECOMBINATION,11,3,0.86,0.644,0.96,0.86,0.85,0.87,0.8,0.76,0.74,0.72,0.73,1,"Mus81, Nbn, Pold3, Pold4, Rad50, Rpa2, Rpa3, Shfm1, Ssbp1, Top3a, Top3b;mTOP3beta","Nbn, Pold4, Shfm1"
KEGG_PHOSPHATIDYLINOSITOL_SIGNALING_SYSTEM,32,12,0.846,0.644,0.77,0.78,0.77,0.82,0.82,0.77,0.76,0.74,0.7,3,"AK051424;Inpp4a, Calm1, Calm2, Calm3, Cdipt, Cds2, Dgkd;mKIAA0145, Dgkz, Impa1, Impa2, Inpp1, Inpp5b;INPP5P;Mir698, Inpp5k, Ippk, Itpk1, Itpr1, Itpr2, PLC-epsilon;Plce1, Pi4ka;Pik4ca, Pik3c2a, Pik3c3, Pik3ca, Pik3r1, Pik3r2, Pikfyve, Pip4k2b, Pip5k1a, Pip5k1c, Plcb1, Plcg1;AK169777, Pten, Synj1","Calm3, Cds2, Impa1, Impa2, PLC-epsilon;Plce1, Pi4ka;Pik4ca, Pik3c3, Pik3r1, Pik3r2, Pip5k1a, Plcb1, Plcg1;AK169777"
KEGG_P53_SIGNALING_PATHWAY,26,9,0.881,0.644,0.83,0.69,0.68,0.66,0.65,0.62,0.6,0.61,0.59,2,"Bax, Bbc3, Bid, Casp8, Ccng2, Cd82, Cdk4, Cdkn1a, Cycs, Ei24, Fas, Gadd45a, Gadd45b, Gadd45g, Igf1, Mdm2, Perp, Ppm1d, Pten, Rchy1, Rfwd2, Sesn1, Sesn3, Shisa5, Steap3, Zmat3","Cd82, Cycs, Gadd45b, Igf1, Mdm2, Rchy1, Rfwd2, Sesn1, Zmat3"
KEGG_UBIQUITIN_MEDIATED_PROTEOLYSIS,86,35,0.897,0.644,0.9,0.82,0.81,0.79,0.74,0.68,0.65,0.64,0.64,1,"AK160359;Ube2j2, AK197603;Uba7;AK157941;Cdh29;Ube1l;D330022A01Rik;Cdhr4;Ip6k1, Anapc1, Anapc11, Anapc13, Anapc2, Anapc4, Anapc5, Anapc7, Birc6;AK165120, Cblc, Cdc16, Cdc26, Cdc34, Cul1, Cul2, Cul3, Cul4a, Cul5, Ddb1, Fbxo4, Fbxw11;mKIAA0696;Btrc;mKIAA4123, Fbxw7, Fbxw8, Fyr;Fzr1, Gm2058;Ube2h, Herc1, Herc2;rjs, Huwe1;KIAA312;mKIAA0312, Itch, Mdm2, Mgrn1;mKIAA0544, Miz1;Pias2, Nedd4, Pias1, Pias4;PIAS-gamma, Pml, Ppil2, Prpf19, Rbx1, Rchy1, Rfwd2, Rhobtb2;Dbc2, Rnf7, Sae1, Smurf1, Smurf2, Socs3, Stub1, Tceb1, Tceb2, Trim37, Trip12;AK032919, Uba1, Uba2, Ube2a, Ube2b, Ube2d2, Ube2d3;Ube2d2b, Ube2e1, Ube2e2, Ube2e3, Ube2f, Ube2g1, Ube2g2, Ube2j1, Ube2k, Ube2l3, Ube2l6, Ube2m, Ube2o, Ube2q1, Ube2r2, Ube2z, Ube3a, Ube3b, Ube3c;mKIAA0010, Ube4a, Ube4b;Ufd2, Ubox5;Fastkd5, Ubr5;mKIAA0896, Vhl, Wwp1, Wwp2, Xiap, mKIAA0439;Nedd4l","AK160359;Ube2j2, Cblc, Cdc34, Fbxo4, Fbxw11;mKIAA0696;Btrc;mKIAA4123, Fbxw7, Fbxw8, Gm2058;Ube2h, Huwe1;KIAA312;mKIAA0312, Mdm2, Mgrn1;mKIAA0544, Nedd4, Pias4;PIAS-gamma, Ppil2, Prpf19, Rchy1, Rfwd2, Rhobtb2;Dbc2, Smurf1, Smurf2, Stub1, Uba1, Ube2b, Ube2e2, Ube2f, Ube2k, Ube2l3, Ube2m, Ube2q1, Ube3a, Ube3b, Ube3c;mKIAA0010, Ube4b;Ufd2, Vhl, Xiap"
KEGG_SNARE_INTERACTIONS_IN_VESICULAR_TRANSPORT,24,8,0.893,0.644,0.71,0.78,0.83,0.84,0.81,0.74,0.7,0.7,0.7,2,"Bet1, Bet1l, Bnip1;Sec20, Gosr1, Gosr2, Sec22b, Snap23, Snap29, Snap47, Stx12, Stx16, Stx17, Stx18, Stx2, Stx6, Stx7, Stx8, Use1, Vamp2, Vamp4, Vamp5, Vamp8, Vti1b, Ykt6","Bet1, Bet1l, Gosr1, Sec22b, Stx17, Stx2, Stx8, Ykt6"
